tweet_id	query	disease	created_at	screen_name	text	description	location	timezone	user_id	coordinate	tweets_per_user	posted_by	talk_about
720699060919918592	Inhaler	Asthma	2016-04-14 19:43:40	tarasilvers	The worst thing about the weather getting warmer is me constantly having to use my inhaler bc I die easier lolz	love all & be happy	swartz creek	Hawaii	543983433		1	individual	himself
720700080903352320	asthma	Asthma	2016-04-14 19:47:43	notwaving	@BodenLab I'm definitely going to ask my GP about that even if we have no asthma clinic. I suspect mine is HAI MAST CELLS! related.	She's got everything to gain cos she's a fat girl with a lisp.  [queerio, feminist killjoy, disabled (EDS/dysautonomia), mentally ill, pro-cats]	Misandry Mermaid Lagoon	London	19741858	None	18	individual	himself
720701339513315329	asthma	Asthma	2016-04-14 19:52:43	RottenFleabag	Thankful for some people. I was outside pushing carts, losing my breath because of my asthma acting up. I took this lady's cart and she -	I'm a sewer rat (he/him). Partier, Cheese eater, Drag Queen admirer, Punk & Rockabilly lover.  #LGBTQA @NudistRat is the AD	Derry, NH	Atlantic Time (Canada)	403752659	None	1	individual	himself
720702678104301568	asthma	Asthma	2016-04-14 19:58:03	KelDobbs	@FrostBight I'm fine, asthma problems. Blaine is fine now. Severe ear infection, causing vertigo, which caused barfies. Tits are code 4 now	Aren't you tired of being the strong one? Tired of taking care of everyone? Don't you want someone to take care of you for a change?	Whittier, CA	Central Time (US & Canada)	285190815	None	1	individual	himself
720710536011259904	asthma	Asthma	2016-04-14 20:29:16	Vodstok	RT @nbcbayarea: AMBER ALERT UPDATE: 2-year-old Jason Vargas needs to take asthma medication by 4 p.m. https://t.co/NfWZ6pMOuA https://t.co/...	Purveyor of handcrafted organic, non-GMO artisanal tweets	Home	Eastern Time (US & Canada)	275340250	None	1	individual	himself
720715706376003585	asthma	Asthma	2016-04-14 20:49:49	AmyMarissa92	There seems to be a link between football and me having bad asthma....	24. University of Derby graduate. DCFC fan. Assistant Merchandising Manager at Boots Head Office. Team Healthcare.	Derby, UK	None	242012903	None	1	individual	himself
720763829978849282	Nebulizer	Asthma	2016-04-15 00:01:02	ybruzual	@seanfox4kc dude I hear ya... my current situation #nebulizer	TV Journalist, Mom, Wife, Lover of Politics & Krispy Kreme, UCF Alumna, Surfer	Orlando	Central Time (US & Canada)	18704125	None	2	individual	himself
720769702755246080	asthma	Asthma	2016-04-15 00:24:23	valimanjaro	Bro I just developed asthma pray for me  https://t.co/hyyJYYoSgW	Every night is Valentines everyday is Christmas	Georgia	None	3363563650	None	1	individual	himself
720775367351345152	Inhaler	Asthma	2016-04-15 00:46:53	SamScurry	That inhaler gave me LIFE	Hi I'm Sam, I'll two step to ur heart beat if you give me the chance. 20. NO I'm not a lesbian, it's about hearts not parts homie. just ur local motel slut.	Gtx to Htx	Central Time (US & Canada)	49703618		1	individual	himself
720782334321168384	Inhaler	Asthma	2016-04-15 01:14:34	LimaDaSkeema	@_loveAR nigga my inhaler in the car and I'm getting ready for work		216		4843694211		1	individual	himself
720784629779673088	asthma	Asthma	2016-04-15 01:23:41	TheRealQd	If you dont like me , coo . thats yo personal problem, i aint fina kiss ya ass or chase ya i got asthma	June 4th	CHS |Senior | ClassOf2016	None	3660783744	None	1	individual	himself
720792014938357760	Inhaler	Asthma	2016-04-15 01:53:02	lazyshithead	Oh inhaler, how I have and haven't missed you https://t.co/pTB62MCr6N	Live what you love	Naperville Illinois	Pacific Time (US & Canada)	2372051313		1	individual	himself
720804833771528192	asthma	Asthma	2016-04-15 02:43:58	NailedJo	Asthma. ....what's next?	My motto is A life of Fear is a life Half-Lived! I'm a Mother of 3, Married 18 years, I'm a Nail Technician & Own my own Nail Salon!		Eastern Time (US & Canada)	335980059	None	1	individual	himself
720808191123185664	asthma	Asthma	2016-04-15 02:57:19	himespetchi	SNEEZING ISNT SUPPOSED TO HURT BUT MY THROAT IS DYING BECAUSE ASTHMA SO FUCK!	hey im izzy/melody  aikatsu!, 's/aqours, t7s, precure, pripara, tamagotchi, splatoon  nico #590 will be my death	16 |  | she/her thanks	None	2939189554	None	2	individual	himself
720818842159558656	asthma	Asthma	2016-04-15 03:39:38	BriZapata14	@moorgansmithh NOT AN ASTHMA ATTACK! That would be too hard. I said I had sports asthma  lmao it only happened when I was running	Honu {} Wicked Witch of the Wheat		Mountain Time (US & Canada)	469886879	None	1	individual	himself
720827569260498944	asthma	Asthma	2016-04-15 04:14:19	ethuggaa	really hate having asthma dude	#NSU20		None	1610214439	None	1	individual	himself
720828125563658240	asthma	Asthma	2016-04-15 04:16:32	jinhwansview	@kjmgwon checking for asthma	high !!		Alaska	282415040	None	2	individual	himself
720829267840335872	Inhaler	Asthma	2016-04-15 04:21:04	Heazeee	Me finding my inhaler was GOD! I was ready just go emergency room like I deadass could not breathe	la familia por encima de todo instagram and snapchat: heazeee	DMV	Eastern Time (US & Canada)	36151014		1	individual	himself
720840874024771588	Inhaler	Asthma	2016-04-15 05:07:11	crystalizedacid	Need my inhaler :/			Arizona	556661563		1	individual	himself
720856136635719680	asthma	Asthma	2016-04-15 06:07:50	HaleighWillis	Darn you asthma	dog mama and pizza enthusiast	Newton, KS	Eastern Time (US & Canada)	567783370	None	1	individual	himself
720906412906274816	asthma	Asthma	2016-04-15 09:27:37	joycepringless	Skin asthma sucks	R&D Specialist/Formulator/Pharmacist	QC	None	3615688994	None	1	individual	himself
720906636362170368	Inhaler	Asthma	2016-04-15 09:28:30	arsatiki	Ive not needed the asthma inhaler in two days. I no longer feel cold all the time. Could this mean I finally beat the virus?	Ett ljusar ar en grav	Helsinki	Helsinki	38168260		1	individual	himself
720930123080450048	asthma	Asthma	2016-04-15 11:01:50	TimeToLoveJJ	@yunjae_9095 oh unnie take some rest ;-; mine is just asthma crisis I did what I had to do but in the rush of morning..  Not much better.	half a heart without you, .    this is my ocean   5   I believe in yunjae's love  /JYJ	Brasil	Brasilia	277765815	None	2	individual	himself
720951032461664256	asthma	Asthma	2016-04-15 12:24:55	RonaCelina	SUMMER SEASON  = ASTHMA SEASON  RAINY SEASON  = ASTHMA SEASON	paper cuts and coffee stains		Hong Kong	70015416	None	1	individual	himself
720963703399649283	asthma	Asthma	2016-04-15 13:15:16	bryonycdc	sooo why have i been prescribed asthma medication for my skin allergies??	crazy dog and disneyworld lady	hertfordshire	London	190651352	None	1	individual	himself
720979242758967296	asthma	Asthma	2016-04-15 14:17:01	abbylibabol	Too much dog fur for today. Asthma is visiting me.	help me.	lost	Beijing	1615132364	None	1	individual	himself
720989048018305024	asthma	Asthma	2016-04-15 14:55:59	FlexinLike_Fatz	On folks I got asthma that shit oowit	Is it a heaven for a G FatHead whats poppin homie yeah i know you gone partner but you ain't forgotten homie FatzGang Zekoworld ABlock StreetzVille LongLiveMarc		Central Time (US & Canada)	333212025	None	2	individual	himself
720993969749012481	asthma	Asthma	2016-04-15 15:15:32	SJRogue	@Spacekatgal If you have asthma it also makes you want to die, in which case it's kind of a wash	The social conscience of Mister Rogers, but without the patience or the clemency. Aspiring dildo artisan.		None	3689950997	None	2	individual	himself
721002809794170881	Inhaler	Asthma	2016-04-15 15:50:40	ChrissieCusack	Love my inhaler...lungs felt pants about 10mins in took my inhaler slowed down and managed to come back &amp;finish strong...#yeah	Mother Lover Runner...#LFC #YNWA #yogini #workingonmeguns have a massive crush on @jonelcock #phwoar	Shropshire Lass		1595279418		1	individual	himself
721010193073643522	Inhaler	Asthma	2016-04-15 16:20:00	drea_rena	I couldn't just find my glasses or my inhaler.	RestUp-DARIUS		Pacific Time (US & Canada)	282415829		1	individual	himself
721013087768330241	asthma	Asthma	2016-04-15 16:31:30	kathrynnnw	@IdealWorldTV #JoinTheIdealParty had a  bouncy castle at 7! downside was that I was an asthmatic and excited myself into an asthma attack	Third year uni student be the change you wish to see in the world	South West, England	London	766432711	None	1	individual	himself
721035665186623488	asthma	Asthma	2016-04-15 18:01:13	brittanylutz_	just thinking about going to conditioning in 2 hours is making me have an asthma attack	i am literally a disaster lmao // albright college		Central Time (US & Canada)	163613703	None	2	individual	himself
721048184781475840	Inhaler	Asthma	2016-04-15 18:50:58	GILFnextdoor	@MadiHellweg @HeatherTrost1 *straps on my epilepsy helmet* *reloads my inhaler*	blub-blub		Atlantic Time (Canada)	553079502		1	individual	himself
721060969112342528	asthma	Asthma	2016-04-15 19:41:46	Joel_Cross95	Konnichiwa And Sremmlife 2 both up for pre order ,who has an asthma pump on deck for me?!!!	#Konnichiwa #ThatsNotMe #BBK Peace ,Love &Happiness Forever		None	290148175	None	1	individual	himself
721065057396740096	Inhaler	Asthma	2016-04-15 19:58:01	aliciafoster97	THE ONE TIME IN SIX MONTHS I NEED MY INHALER AND I CANT FIND IT	Travelling makes me happy. lemonade enthusiast. Theatre. 'Love all, trust a few, do wrong to none'	Wigan	Hawaii	93934820		1	individual	himself
721078775325270026	asthma	Asthma	2016-04-15 20:52:31	premiumoakley	I'd be so pissed off if I have an asthma attack at @troyesivan	{insert nice message someone said to me}	18.4.16	Pacific Time (US & Canada)	713108109	None	1	individual	himself
721087480657645568	Inhaler	Asthma	2016-04-15 21:27:07	kyranjnerland	SOS in need of an inhaler	Why do you do the things you do? Do you want to know me?	The Halocline	Arizona	785933018		1	individual	himself
721088344210468864	asthma	Asthma	2016-04-15 21:30:33	clarkes_murphy	@ehlizas dONT EVEN PLAY ME LIKE THAT I WILL HAVE AN ACTUAL ASTHMA ATTACK	lindsey morgan knows I exist and I don't know how to handle this information.	crying over clexa	London	185609437	None	3	individual	himself
721102027103805440	asthma	Asthma	2016-04-15 22:24:55	chosen_rosin	@donsuzlew ok but I can't be the lungs because asthma	| just trying to relive the 90's | ID-VA-TN | Lipscomb University '18	Nashville, TN	None	2148783387	None	1	individual	himself
721103399752740865	asthma	Asthma	2016-04-15 22:30:22	fadinglester	omfg i hate asthma	ive got 99 problems and fandoms are the cause of most of them		Pacific Time (US & Canada)	4196069613	None	1	individual	himself
721123894275346432	Inhaler	Asthma	2016-04-15 23:51:48	jenniferemm	The first thing my mom said before I left was  do you have your inhaler lol yes mom	UNLV		Arizona	230632724		4	individual	himself
721127753211342852	asthma	Asthma	2016-04-16 00:07:08	NoMoreAsthma	It is not known if #asthma causes psychological problems or if psychological problems lead to asthma.	Natural Approach To Curing Asthma	London	Kyiv	2466687799	None	105	individual	himself
721129259880685568	asthma	Asthma	2016-04-16 00:13:08	Ricky_Moreno315	Haven't used a humidifier since I was a boy but work has my asthma all fucked up		CO	Pacific Time (US & Canada)	812117660	None	1	individual	himself
721135935497195520	asthma	Asthma	2016-04-16 00:39:39	TinyKyrus	I SUMMON YOU, ASTHMA ATTACK *kicks dust everywhere*	[sup im a bot] EY YO GIMME THAT PASTA UR DOING IT WRONG omgf	in a bowl of spaghetti-o	None	1198491842	None	2	individual	himself
721138200190840833	Inhaler	Asthma	2016-04-16 00:48:39	tillerdolans_	stevens snAPchaT someone get my inhaler	I talk alot.	2/2 and still screaming	Eastern Time (US & Canada)	3069966031		1	individual	himself
721142930497347584	asthma	Asthma	2016-04-16 01:07:27	JJOrtizzy	watch em grasp asthma	God 100!!! When I meet my maker He's gonna make sure that we're chillin... Everythings Good. Arizona State Alum '11 #forksup	LA/ASU	Pacific Time (US & Canada)	29068076	None	1	individual	himself
721147868363358208	asthma	Asthma	2016-04-16 01:27:04	srhkhn	i'm not even 5 minutes into asthma and i'm already in love with the cinematography	your metaphorical gin and juice	ml	Central Time (US & Canada)	180203122	None	1	individual	himself
721150483533012993	asthma	Asthma	2016-04-16 01:37:28	lilmeece03	@kristen14337 twins cause we both had asthma probs tonight haha STILL ALIVE THO	Live without pretending, Love without depending, Listen without defending, Speak without offending.	Liberty, KY	None		None	1	individual	himself
721160866947665921	asthma	Asthma	2016-04-16 02:18:43	whitely24	Hayley literally coughs every 5 seconds.... Asthma.. Ew	~bat city~ pykachoo98~		None	2179062306	None	1	individual	himself
721164632363180034	asthma	Asthma	2016-04-16 02:33:41	raginghippie	Sooooo it would be nice if I could breathe properly... #asthma #allergyseason	Lover of nature, tea, outer space & cats. Flaming mostly-lesbian. David Bowie, Freddie Mercury & Tilda Swinton enthusiast. Fan of all things fantasy.	Bog of Eternal Stench	Pacific Time (US & Canada)	492725717	None	1	individual	himself
721171742291468289	asthma	Asthma	2016-04-16 03:01:56	CjCessy	Asthma attack again and again .		National Capital Region	None		None	1	individual	himself
721185344821944321	Nebulizer	Asthma	2016-04-16 03:55:59	boltonnut	@nycki96 Yeah, my chest is really hurting but I'll be on the nebulizer soon. did u know I finally got one?	single, socialize, love people, Michael Bolton and Bee Gees are my favorite musicians, email with people, just love life.	Southern Nevada	Pacific Time (US & Canada)	64849042	None	7	individual	himself
721207492294742016	asthma	Asthma	2016-04-16 05:24:00	Kunaaaaaa	One whole night till now using aircond. And now got asthma attack. Good		Malaysia	Beijing	340843770	None	1	individual	himself
721234341624348672	Inhaler	Asthma	2016-04-16 07:10:41	biancaiwunze	y'all I've been using my inhaler ya bish still can't breathe		dtx	Central Time (US & Canada)	275360670		3	individual	himself
721253372687486976	asthma	Asthma	2016-04-16 08:26:18	MsTick68	@pegdeg I'll add ask my GP next time I'm there. I have to go for an asthma check soon.	University PGCE lecturer. Special offer Prosecco socialist. Shares a teapot with @librarypigg. Loving stepmum to Small Boy.	The Chalk	Amsterdam	23178902	None	1	individual	himself
721289808824250369	asthma	Asthma	2016-04-16 10:51:05	georgiamakai	i really want to have a sibe but parents and asthma	SHAPESHIFTER at heart	Misfit Toys Island	Beijing	635922405	None	2	individual	himself
721299139183554560	asthma	Asthma	2016-04-16 11:28:10	aireenannnnn	Asthma	90's kid  Daddy's Girl IG: @aireenannnnnn	Manila Phillipines	Alaska	263526177	None	1	individual	himself
721324955980406784	Inhaler	Asthma	2016-04-16 13:10:45	WhatWouldSosaDo	Fuck me I can't find my inhaler	Cash Ruined Everything Around Me.	Indigo Plateau	Quito	188840801		3	individual	himself
721331957079154690	Inhaler	Asthma	2016-04-16 13:38:34	cutieegrande	I can't even go to the dentist without bringing my inhaler that makes me so freaking mad		nina and steven	Pacific Time (US & Canada)	2956652258		1	individual	himself
721400526584197120	Nebulizer	Asthma	2016-04-16 18:11:03	LarkinsGregory	Is themselves momentous that straight a nebulizer forsooth be in existence fda official first him accept alter ...			Istanbul	1240572565	None	212	individual	himself
721407936363298816	Inhaler	Asthma	2016-04-16 18:40:29	AlysonFouse	Is it possible that my mailman is illiterate? Every piece of mail we got belonged to our neighbors. So, who's huffing on my inhaler?	Storyteller. World creator. Writer for hire. Word pimp. Director, too. Show Runner of #BornAgainVirgin. Accept it. https://t.co/vraHTG8bhF	U.S.A.	Arizona	293337170		1	individual	himself
721424785859686400	Inhaler	Asthma	2016-04-16 19:47:27	that_sam_girl	@jimmyfallon makes me need my inhaler						2	individual	himself
721508517979394049	Inhaler	Asthma	2016-04-17 01:20:10	hasmiakim	Where's my inhaler when I need it  universe out here wanting me to suffocate or something	feed me or else	PI		3243302208		1	individual	himself
721669717338025984	Inhaler	Asthma	2016-04-17 12:00:43	ArianaaaILYSM	May 20th is so close , i need to get ready    inhaler    cold water and a fan in case i faint   glue for my weave	you are my person		Athens	1416175412		1	individual	himself
721687399340838912	Inhaler	Asthma	2016-04-17 13:10:58	iLuvCaine	whole lotta coughing, wheezing, inhaler pumps, steroid doses and breathing treatments later .. son still ain't doing NO better	the earth is Caine's turf.		Hawaii	382962914		1	individual	himself
721721812501987328	Inhaler	Asthma	2016-04-17 15:27:43	nissabear_	Beyonce can run 3 miles while singing but I can't walk up 3 flight of stairs without wondering where my inhaler is	ugh		Eastern Time (US & Canada)	599790301		1	individual	himself
721824558919987200	Inhaler	Asthma	2016-04-17 22:16:00	jessi_kincaid	Going on a bike ride without my inhaler was a horrible idea	Throw me to the wolves and I will return leading the pack.			3029306625		1	individual	himself
721838215980683264	Inhaler	Asthma	2016-04-17 23:10:16	topsbf	i love bigbang so much I need my inhaler		he/him	Pacific Time (US & Canada)	484430916		1	individual	himself
721869573201522689	Inhaler	Asthma	2016-04-18 01:14:52	1017kasaun	I need to buy an inhaler from somebody bcs i dont feel like making a docs appt to get one  somebody look out	IG: sossasaun	Gip Capo ; Sip Bailey	Atlantic Time (Canada)	62102466		1	individual	himself
721891457884237824	Inhaler	Asthma	2016-04-18 02:41:50	ohkiggy	I had an asthma attack hiking today and I didn't have my inhaler and we were 3 miles into the trail and it was the scariest shit ever	he knows me afxvehsb :)))	la	Pacific Time (US & Canada)	2801036700		2	individual	himself
721891949117054976	Inhaler	Asthma	2016-04-18 02:43:47	WaltonPryce	RT @frankevans111: Spiriva respimat inhaler. Buy Spiriva at https://t.co/AWt6jC3aTn Trusted Internet Drugstore! Free Shipping!				4877087069		1	individual	himself
721898731122094080	Nebulizer	Asthma	2016-04-18 03:10:44	DeyBeOnANigga_	@will6foot5 I got bronchitis BAD. I use a humidifier and a nebulizer	3 the hard way. Kobe, Jay-Z & Pac raised me. RIP Mommy!	Monroe, Louisiana	America/New_York	25848834	None	1	individual	himself
721906741609299968	Inhaler	Asthma	2016-04-18 03:42:34	OnlyMeBrandi	Sammy sent me a gold inhaler on a chain and called me b-wheezy	Validation is my main bitch	TEJAS	Central Time (US & Canada)	118248342		2	individual	himself
722019397855027200	Inhaler	Asthma	2016-04-18 11:10:13	AG3photography	chemist gave me wrong inhaler so phoned surgery they said chemist says come round they'll swap it, get there, oh, we need to order that	Sometime photographer, my own  worst critic and general lazy git.	Glasgow	London	2554513952		1	individual	himself
722053271070892032	Inhaler	Asthma	2016-04-18 13:24:49	TrippyAss_	I wish my health insurance would stop playing with me I need a new inhaler and a humidifier		M.I.A		536699647		1	individual	himself
722058304772534272	Albuterol inhaler	Asthma	2016-04-18 13:44:49	Jon_PharmD	@freakonomics Should PharmDs have provider status &amp; prescriptive autonomy?  Why do I need an ER doc at 3AM for an albuterol inhaler?	Drummer.  PharmD.  Professional Bad Ass.	Nashville, TN	None	4841021325	None	1	individual	himself
722060374854336513	Inhaler	Asthma	2016-04-18 13:53:03	TuriKun	This is me with my inhaler lmao https://t.co/wiAAvbGsSJ	Asthmatic | Capricorn | Funny | Gamer | Ravenclaw Wizard | Pokemon Trainer | Duelist	San Antonio, TX	Central Time (US & Canada)	80177957		1	individual	himself
722065879358263296	Inhaler	Asthma	2016-04-18 14:14:55	Arlethe_Herrera	y'all I can't find my inhaler and I can't breathe	And so being young and dipped in folly, I fell in love with melancholy.	ATX	Eastern Time (US & Canada)	487498138		2	individual	himself
722094047855124480	Nebulizer	Asthma	2016-04-18 16:06:51	larentschonces	some1 pls call mom i need my nebulizer rn	harry is the real definition of beauty & happiness	louz aira nikka nicc elle jiah	Beijing	1580238289	None	1	individual	himself
722182074380124160	Inhaler	Asthma	2016-04-18 21:56:38	gedolantwin	@EthanDolan @GraysonDolan SOMEONE GIVE ME AN INHALER CUZ I CANT BREATHE  IM DEAD #DolanTwinsNewVideo 48	follow @/dolamtwins on insta	Texas, USA		4694429425		99	individual	himself
722182841761566720	Inhaler	Asthma	2016-04-18 21:59:41	gedolantwin	@EthanDolan @GraysonDolan SOMEONE GIVE ME AN INHALER CUZ I CANT BREATHE  IM DEAD #DolanTwinsNewVideo 81	follow @/dolamtwins on insta	Texas, USA		4694429425		99	individual	himself
722200647349579776	Nebulizer	Asthma	2016-04-18 23:10:26	justineagsalud	Nebulizer! Where are you?	I'm not your typical kind of Boy	Legazpi City, Bicol Region	None		None	1	individual	himself
722203320501321728	Inhaler	Asthma	2016-04-18 23:21:04	AndreaLebrondo	Guess who can't find their inhaler	When Trouble Comes Say Amen and When Trouble Goes Say Amen .		Quito	324685038		1	individual	himself
722229682041655297	Inhaler	Asthma	2016-04-19 01:05:49	OdiN_729	Anyways . tense moments.. I need my inhaler. #WeTheNorth	Not your typical asian girl. Toronto sports homer. imfc fan tho ! #RomanEmpire	Toronto	Eastern Time (US & Canada)	197656102		1	individual	himself
722257802316480512	Inhaler	Asthma	2016-04-19 02:57:33	uhlissuh	When you're sick as fuck and have to use an inhaler	i'm the one ya bitch like	orlando	Atlantic Time (Canada)	1337989646		2	individual	himself
722291533030903808	Inhaler	Asthma	2016-04-19 05:11:35	Ashnicole1111	@DubsLKK terrible!! So frustrating. I'm laying here coughing nonstop &amp; need to go get my inhaler since I can feel the attack coming	Baseball is my one true love!#ForTheLoveOfTheGame #CardinalNation #DubNation #MiamiHurricanes #TheU #RaiderNation #GirlsWhoLoveSports	Bay Area, CA		361915149		2	individual	himself
722302576775946240	Inhaler	Asthma	2016-04-19 05:55:28	_SidneyLynn	Puffing on an inhaler while tryna be cute is not sexy	I never cared. Fuck your feelings	Earth	Central Time (US & Canada)	260386161		2	individual	himself
722303526257315840	Inhaler	Asthma	2016-04-19 05:59:15	QueenKeniaa	Where is my inhaler when i need it	SRHS c/o 2015- College Student Instagram:keniafloress		Pacific Time (US & Canada)	563135740		1	individual	himself
722412615864041472	Peak Flow Meter	Asthma	2016-04-19 13:12:44	Jbed3	50 charge for my prescription of a peak flow meter... Come and search me house I don't own one	supporting the least successful football team since my birth in 91.	Stoke-on-Trent	London	40233572		1	individual	himself
722452614772760578	Nebulizer	Asthma	2016-04-19 15:51:40	BaileyDerrick2	Is ego memorable that an nebulizer forsooth persist fda accepted by vote one and only have superego?: fVYUc			Kuwait	1240746872	None	221	individual	himself
722489485062180864	Inhaler	Asthma	2016-04-19 18:18:11	BCpostergirl	@TravelLeisure @NatlParkService @gov  A3. Sunglasses, sunscreen, hat, inhaler, layers of clothes...#TL_Chat	Avid Traveler, Prude with an attitude		Eastern Time (US & Canada)	68304114		1	individual	himself
722505432426676224	Inhaler	Asthma	2016-04-19 19:21:33	worldofhue	sometimes i get so upset when i cry that i can't breathe anymore, i always take my inhaler	what's a bio without a personality	the emptiness you can't fill		2316150566		1	individual	himself
722505439783596034	Inhaler	Asthma	2016-04-19 19:21:35	GORESPORE	hoo boy i didnt takemy inhaler this morning and im really feeling it my lungs are screaming	im sab aND SOMETIMES I DRAW !!!  interests atm  ocs + op  otps  dofladile, bartodish, sanuso.   pixiv id  7754855	sab/cora  18  he/him	Eastern Time (US & Canada)	2222940894		1	individual	himself
722523629418754049	Inhaler	Asthma	2016-04-19 20:33:51	Brad_Attitude	Doug Funnie  where's my inhaler???	No Arianas formed against me shall prosper!		Central Time (US & Canada)	347474313		1	individual	himself
722538832109903872	Inhaler	Asthma	2016-04-19 21:34:16	_C_Drew	damn u pollen, I gotta use an inhaler for now	snapchat: yungjigga	DMV	Georgetown	146553363		1	individual	himself
722559901856305153	Nebulizer	Asthma	2016-04-19 22:57:59	LilyySweetHeart	The nebulizer got me trembling &amp; shaky		Bronx, NY	Eastern Time (US & Canada)	152304123	None	2	individual	himself
722605909352951808	Inhaler	Asthma	2016-04-20 02:00:48	emmalgrr	@CourtneyGotti i wouldve forgotten my freaking inhaler thanks for reminding	USC '20 #gococks			2160194124		1	individual	himself
722627199887478784	Inhaler	Asthma	2016-04-20 03:25:24	Lyan_King_	This third period is going to be insane. I have my inhaler ready.	Be the alpha #Blackhawks #Bears #SoxSide #Bulls #FightingIrish	Chicago, IL	Central Time (US & Canada)	57644034		1	individual	himself
722629013974298626	Nebulizer	Asthma	2016-04-20 03:32:37	TeejayDelizo	Nebulizer pleasee  JasonDyAsEmersonBML	God can only make happy endings, if it's not yet happy well it's not the end. || Jason James Dy's  ||  This Twitter Account was made for Jason Dy IG: @tjdelizo		Urumqi	2822636771	None	1	individual	himself
722635470732025856	Inhaler	Asthma	2016-04-20 03:58:16	_ZENAY23_	Omgg I was having a major panic mode looking for my inhaler while trying to gasp for air	happy hoes ain't hatin' & hatin' hoes ain't happy . @Patriots #ThunderUp	Palmview, TX	Pacific Time (US & Canada)	4634552616		2	individual	himself
722650104117768192	Inhaler	Asthma	2016-04-20 04:56:25	IRSTAEHYUN	IM A DUMBASS I BROKE MY INHALER :((((						2	individual	himself
722664701419720705	Inhaler	Asthma	2016-04-20 05:54:25	07Arrayah	currently weazing and I can't find my inhaler	snapchat// arrayah_0707 #skn			2942320219		1	individual	himself
722685745224409088	Inhaler	Asthma	2016-04-20 07:18:03	ciluom_	Omg that hike wouldve been really easy for me tho if i brought my inhaler lololollol			Pacific Time (US & Canada)	1339659888		1	individual	himself
